Bearing Type,Bearing,So. no,KSB Invoice,Price,KSB Invoice Date
Deep Groove Ball Bearings Part No. 321,"""3309 C3""",nsdmbf321e2,nbdzmfbaf3e,"563,561",2024/03/14
ANGULAR CONTACT BEARINGS PART NO 320,"""7206 BG""",sndfjn1341,dnfjn234,"452,340",2024/03/20
Deep Groove Ball Bearings Part No. 321,"""6308 2ZR C3""",kndajkf3423,dnfkjw342,"34,234",2024/03/05
CYLINDRICAL ROLLER BEARINGS PART NO 322,"""NU 211 E C3""",ndfkjnwkj3423,ndjfnkj34,432,2024/03/20
ANGULAR CONTACT BEARINGS PART NO 320,"""7308 BECBP""",kndsfkjns342,sndfn2342,"54,646",2024/03/28
